{
  "version": 3,
  "object": "task-slot",
  "description": "作業の枠(自分一人でやる、時間枠つきの作業)の完了記録の状態と出来事の閉語彙(正本)。時間枠の定義は予定データ(Git)に残り、この語彙は済んだ・やめたの記録だけを持つ。worklog の slot kind が include_str! で読む。タイマーは持たない(再通知も失効もしない)。共通の形は config/agents/vocabulary/vocabulary.schema.json。",
  "initial": "none",
  "states": [
    { "id": "done", "terminal": true },
    { "id": "dropped", "terminal": true }
  ],
  "events": [
    { "id": "done", "from": ["none"], "to": ["done"], "by": "person", "carriers": ["cli:worklog", "skill:daily-desk"], "gates": ["cli:worklog"] },
    { "id": "drop", "from": ["none"], "to": ["dropped"], "by": "person", "carriers": ["cli:worklog", "skill:daily-desk"], "gates": ["cli:worklog"] }
  ]
}
